{
  "metadata": {
    "solution": "04-finra-supervision-workflow",
    "solutionCode": "FSW",
    "exportVersion": "1.1.0",
    "exportedAt": "2026-07-14T05:26:56.6185199-04:00",
    "tier": "regulated",
    "policyId": "00000000-0000-0000-0000-000000000000",
    "environmentUrl": "https://REPLACE-ME.crm.dynamics.com",
    "warning": "Documentation-first export emits configuration-based sample evidence. Use -LiveExport with Dataverse connectivity before treating supervisory controls as implemented.",
    "periodEnd": "2026-01-31",
    "periodStart": "2026-01-01",
    "evidenceMode": "documentation-first"
  },
  "summary": {
    "overallStatus": "partial",
    "exceptionCount": 1,
    "recordCount": 13,
    "findingCount": 3
  },
  "controls": [
    {
      "controlId": "3.4",
      "status": "partial",
      "notes": "Documentation-first sample evidence captures the intended queue, sampling, and SLA pattern; live Dataverse rows are required before treating supervisory coverage as implemented."
    },
    {
      "controlId": "3.5",
      "status": "partial",
      "notes": "Documentation-first sample evidence preserves the intended review-disposition contract, but live reviewer actions are not exported by default."
    },
    {
      "controlId": "3.6",
      "status": "partial",
      "notes": "Exception tracking configuration is documented and exportable, but default repository output remains documentation-first until live Dataverse evidence is supplied."
    }
  ],
  "artifacts": [
    {
      "name": "supervision-queue-snapshot",
      "type": "supervision-queue-snapshot",
      "path": "supervision-queue-snapshot.json",
      "hash": "019a8f20058fbdc333bf52c5fdfa71075a0648e3372e7e7a8389204fa9e18b19"
    },
    {
      "name": "review-disposition-log",
      "type": "review-disposition-log",
      "path": "review-disposition-log.json",
      "hash": "d4eebabf05e126e6fd6ae79bcad24c6d078c558f55fbfacaa67261acc6511967"
    },
    {
      "name": "sampling-summary",
      "type": "sampling-summary",
      "path": "sampling-summary.json",
      "hash": "3f6a491595a05344b9f3f4d357e7d795fcf0dd68bfc8b6cf4e705011a8416c13"
    }
  ]
}
